{
  "protocol_version": "SMI-CP/RCL-PC/CONFIG/2",
  "block_id": "RCL-PC-GPT56SOL-IOS-20260901-A",
  "recorded_at_utc": "2026-09-01T15:23:08Z",
  "provider": "OpenAI",
  "product": "ChatGPT",
  "model_label": "GPT-5.6 Sol",
  "model_build_or_snapshot": null,
  "interface": "ChatGPT native iOS app with GitHub connector-mediated issue interaction",
  "interface_build": "ChatGPT/1.2026.230; iOS 26.6.1",
  "conversation_state": "fresh",
  "memory_state": "enabled",
  "customization_state": "present",
  "reasoning_setting": "GPT-5.6 Sol",
  "locale": "ar-SA; protocol messages in English",
  "available_tools": [
    "GitHub connector",
    "web retrieval",
    "conversation file and library tools",
    "Python execution",
    "Remote Desktop Commander",
    "Google Workspace connectors",
    "Adobe and Canva connectors",
    "image generation"
  ],  "permitted_trial_tools": [
    "GitHub issue read",
    "GitHub issue comment"
  ],
  "subject_instruction_path": "experiments/006-rcl-pc-final-freeze/SUBJECT_INSTRUCTIONS.md",
  "subject_instruction_sha256": "6fa4af5edd19d83ab8e41814544a6be69deb17ecca274c83fce4c2d0bff24d39",
  "system_instructions_observable": false,
  "system_instructions_record": null,
  "product_status_page_checked": false,
  "notes": "Only GitHub issue read/comment is permitted during trials. Any visible model-label, client-build, memory, customization, or available-tool change stops this block and requires a new configuration commit and preregistered block."
}
